{
  "schema_version": "1.0.0",
  "trial_id": "example-session-0001",
  "session_id": "example-session",
  "source": {
    "kind": "synthetic",
    "version": "reference-python",
    "protocol_id": "ov-flick-32x3"
  },
  "provenance": {
    "target_truth": "measured",
    "confidence": 1.0
  },
  "device": {
    "name": "example mouse",
    "polling_hz_nominal": 1000.0,
    "dpi": 800,
    "vid": 1133,
    "pid": 50503,
    "polling_hz_measured": 999.7
  },
  "mapping": {
    "yaw_deg_per_count": 0.022,
    "pitch_deg_per_count": 0.022,
    "fov_h_deg": 103.0,
    "counts_stage": "post_driver"
  },
  "active_gain_map_id": "identity",
  "condition": {
    "trial_index": 1,
    "sector": 19,
    "sector_count": 32,
    "amplitude_index": 0,
    "block": 0
  },
  "geometry": {
    "start": {
      "x_counts": 0.0,
      "y_counts": 0.0
    },
    "target": {
      "x_counts": -186.90573689805007,
      "y_counts": -134.03822408028572,
      "radius_counts": 45.0,
      "shape": "sphere"
    },
    "amplitude_counts": 230.0,
    "amplitude_deg": 5.06,
    "direction_theta": 3.763731864370716
  },
  "outcome": {
    "endpoint_primary": {
      "x_counts": -238.0,
      "y_counts": -174.0
    },
    "endpoint_final": {
      "x_counts": -187.0,
      "y_counts": -137.0
    },
    "hit": true,
    "shots_fired": 1,
    "clicks": [
      {
        "t_us": 2803516,
        "x_counts": -187.0,
        "y_counts": -137.0,
        "hit": true
      }
    ],
    "errors": {
      "along_primary": 0.28178102782052217,
      "across_primary": 0.01172969544712121,
      "along_final": 0.007837608675510532,
      "across_final": 0.010225672060858825
    }
  },
  "timing": {
    "clock": "qpc_us",
    "utc_offset_us": 0,
    "t_stimulus_us": 2172782,
    "t_onset_us": 2378782,
    "t_peak_velocity_us": 2471782,
    "t_primary_end_us": 2565782,
    "t_final_click_us": 2803516,
    "reaction_time_us": 201062,
    "reaction_time_basis": "on_screen",
    "movement_time_us": 424734,
    "primary_duration_us": 187000,
    "t_stimulus_on_screen_us": 2177720
  },
  "kinematics": {
    "peak_speed_counts_per_s": 2624.1041020238836,
    "peak_speed_deg_per_s": 57.730290244525435,
    "path_length_counts": 377.9240371311999,
    "n_corrections": 1,
    "submovements": [
      {
        "t_start_us": 2378782,
        "t_end_us": 2565782,
        "dx_counts": -238.0,
        "dy_counts": -174.0,
        "peak_speed_counts_per_s": 2624.1041020238836
      },
      {
        "t_start_us": 2674782,
        "t_end_us": 2763782,
        "dx_counts": 51.0,
        "dy_counts": 37.0,
        "peak_speed_counts_per_s": 1058.4433208819266
      }
    ],
    "segmentation": "ov-velocity-1"
  },
  "excluded_reason": null,
  "context": {
    "trial_index_session": 1,
    "trial_index_block": 1,
    "block": 0,
    "previous": {
      "trial_id": "example-session-0000",
      "direction_theta": 0.11248212073301242,
      "amplitude_counts": 230.0,
      "hit": true,
      "excluded_reason": null
    },
    "inter_trial_interval_us": 600000,
    "time_since_break_us": 1172782,
    "time_since_session_start_us": 1172782
  },
  "path": {
    "t_us": [
      2380782,
      2381782,
      2386782,
      2388782,
      2389782,
      2392782,
      2395782,
      2397782,
      2398782,
      2399782,
      2400782,
      2402782,
      2403782,
      2404782,
      2405782,
      2406782,
      2407782,
      2408782,
      2409782,
      2410782,
      2411782,
      2412782,
      2413782,
      2414782,
      2415782,
      2416782,
      2417782,
      2418782,
      2419782,
      2420782,
      2421782,
      2422782,
      2423782,
      2424782,
      2425782,
      2426782,
      2427782,
      2428782,
      2429782,
      2430782,
      2431782,
      2432782,
      2433782,
      2434782,
      2435782,
      2436782,
      2437782,
      2438782,
      2439782,
      2440782,
      2441782,
      2442782,
      2443782,
      2444782,
      2445782,
      2446782,
      2447782,
      2448782,
      2449782,
      2450782,
      2451782,
      2452782,
      2453782,
      2454782,
      2455782,
      2456782,
      2457782,
      2458782,
      2459782,
      2460782,
      2461782,
      2462782,
      2463782,
      2464782,
      2465782,
      2466782,
      2467782,
      2468782,
      2469782,
      2470782,
      2471782,
      2472782,
      2473782,
      2474782,
      2475782,
      2476782,
      2477782,
      2478782,
      2479782,
      2480782,
      2481782,
      2482782,
      2483782,
      2484782,
      2485782,
      2486782,
      2487782,
      2488782,
      2489782,
      2490782,
      2491782,
      2492782,
      2493782,
      2494782,
      2495782,
      2496782,
      2497782,
      2498782,
      2499782,
      2500782,
      2501782,
      2502782,
      2503782,
      2504782,
      2505782,
      2506782,
      2507782,
      2508782,
      2509782,
      2510782,
      2511782,
      2512782,
      2513782,
      2514782,
      2515782,
      2516782,
      2517782,
      2518782,
      2519782,
      2520782,
      2521782,
      2522782,
      2523782,
      2524782,
      2525782,
      2526782,
      2527782,
      2528782,
      2529782,
      2530782,
      2531782,
      2532782,
      2533782,
      2534782,
      2535782,
      2536782,
      2537782,
      2539782,
      2540782,
      2541782,
      2543782,
      2545782,
      2546782,
      2547782,
      2548782,
      2549782,
      2551782,
      2552782,
      2554782,
      2556782,
      2557782,
      2563782,
      2677782,
      2682782,
      2683782,
      2685782,
      2687782,
      2688782,
      2690782,
      2692782,
      2693782,
      2694782,
      2696782,
      2697782,
      2698782,
      2699782,
      2700782,
      2702782,
      2703782,
      2704782,
      2706782,
      2707782,
      2708782,
      2709782,
      2711782,
      2712782,
      2713782,
      2714782,
      2715782,
      2717782,
      2718782,
      2719782,
      2720782,
      2721782,
      2722782,
      2723782,
      2725782,
      2726782,
      2727782,
      2728782,
      2729782,
      2730782,
      2731782,
      2732782,
      2733782,
      2735782,
      2736782,
      2737782,
      2739782,
      2740782,
      2742782,
      2744782,
      2746782,
      2747782,
      2748782,
      2750782,
      2753782,
      2754782,
      2757782,
      2760782,
      2763782
    ],
    "dx": [
      -1,
      0,
      -1,
      0,
      -1,
      -1,
      -1,
      -1,
      0,
      -1,
      -1,
      -1,
      -1,
      0,
      -1,
      -1,
      -1,
      -1,
      0,
      -1,
      -1,
      -1,
      -1,
      -1,
      -1,
      -1,
      -2,
      -1,
      -1,
      -1,
      -1,
      -2,
      -1,
      -1,
      -2,
      -1,
      -1,
      -2,
      -1,
      -2,
      -1,
      -2,
      -2,
      -1,
      -2,
      -1,
      -2,
      -2,
      -2,
      -1,
      -2,
      -2,
      -2,
      -2,
      -1,
      -2,
      -2,
      -2,
      -2,
      -2,
      -2,
      -2,
      -2,
      -2,
      -2,
      -2,
      -2,
      -2,
      -2,
      -2,
      -2,
      -2,
      -3,
      -2,
      -2,
      -2,
      -2,
      -2,
      -2,
      -2,
      -3,
      -2,
      -2,
      -2,
      -2,
      -2,
      -2,
      -2,
      -2,
      -3,
      -2,
      -2,
      -2,
      -2,
      -2,
      -2,
      -2,
      -2,
      -2,
      -2,
      -2,
      -2,
      -2,
      -2,
      -2,
      -2,
      -2,
      -2,
      -1,
      -2,
      -2,
      -2,
      -2,
      -1,
      -2,
      -2,
      -1,
      -2,
      -2,
      -1,
      -2,
      -1,
      -2,
      -1,
      -2,
      -1,
      -2,
      -1,
      -2,
      -1,
      -1,
      -1,
      -2,
      -1,
      -1,
      -1,
      -1,
      -1,
      -1,
      -1,
      -1,
      -1,
      -1,
      -1,
      -1,
      -1,
      -1,
      -1,
      -1,
      -1,
      -1,
      -1,
      0,
      -1,
      0,
      -1,
      -1,
      0,
      -1,
      0,
      -1,
      -1,
      1,
      1,
      0,
      1,
      0,
      1,
      1,
      1,
      0,
      1,
      1,
      1,
      0,
      1,
      1,
      1,
      1,
      1,
      1,
      1,
      1,
      1,
      1,
      1,
      1,
      1,
      1,
      1,
      1,
      1,
      1,
      1,
      1,
      1,
      1,
      1,
      1,
      1,
      1,
      0,
      1,
      1,
      1,
      1,
      1,
      1,
      1,
      1,
      1,
      1,
      1,
      0,
      1,
      1,
      1,
      0,
      1,
      0,
      1
    ],
    "dy": [
      0,
      -1,
      0,
      -1,
      0,
      -1,
      -1,
      0,
      -1,
      0,
      -1,
      -1,
      0,
      -1,
      0,
      -1,
      0,
      -1,
      -1,
      0,
      -1,
      -1,
      0,
      -1,
      -1,
      -1,
      0,
      -1,
      -1,
      -1,
      -1,
      -1,
      -1,
      -1,
      -1,
      -1,
      -1,
      -1,
      -1,
      -1,
      -1,
      -1,
      -2,
      -1,
      -1,
      -1,
      -1,
      -2,
      -1,
      -1,
      -1,
      -2,
      -1,
      -1,
      -2,
      -1,
      -2,
      -1,
      -1,
      -2,
      -1,
      -2,
      -1,
      -2,
      -1,
      -2,
      -1,
      -2,
      -1,
      -2,
      -1,
      -2,
      -1,
      -2,
      -1,
      -2,
      -1,
      -2,
      -1,
      -2,
      -2,
      -1,
      -2,
      -1,
      -2,
      -1,
      -2,
      -1,
      -2,
      -2,
      -1,
      -2,
      -1,
      -2,
      -1,
      -2,
      -1,
      -2,
      -1,
      -2,
      -1,
      -1,
      -2,
      -1,
      -2,
      -1,
      -1,
      -2,
      -1,
      -1,
      -2,
      -1,
      -1,
      -2,
      -1,
      -1,
      -1,
      -2,
      -1,
      -1,
      -1,
      -1,
      -1,
      -1,
      -2,
      -1,
      -1,
      -1,
      -1,
      -1,
      -1,
      0,
      -1,
      -1,
      -1,